{
    "protocol":  "baijin-codex-bridge-result/1.0",
    "result_id":  "result-review-001",
    "request_id":  "request-review-001",
    "bridge_type":  "review_bridge",
    "repository":  "shunhang776/xinbaijin-mcp",
    "branch":  "dev",
    "codex_role":  "bridge",
    "status":  "READY",
    "conclusion":  "CODEX_REVIEW_BRIDGE_READY",
    "next_actor":  "chatgpt-baijin-reviewer",
    "candidate_commit":  "1111111111111111111111111111111111111111",
    "review_commit":  null,
    "repair_commit":  null,
    "verdict":  null,
    "gate_result":  null,
    "repair_round":  0,
    "events":  [
                   {
                       "event_type":  "REVIEW_BRIDGE_READY",
                       "actor":  "codex"
                   }
               ],
    "produced_files":  [
                           ".codex/review-bridge-observation.json"
                       ],
    "errors":  [

               ],
    "created_at":  "2026-06-27T06:28:05.196Z"
}

