{
    "protocol":  "baijin-codex-bridge-result/1.0",
    "result_id":  "result-repair-001",
    "request_id":  "request-repair-001",
    "bridge_type":  "repair_bridge",
    "repository":  "shunhang776/xinbaijin-mcp",
    "branch":  "dev",
    "codex_role":  "bridge",
    "status":  "READY",
    "conclusion":  "CODEX_REPAIR_BRIDGE_READY",
    "next_actor":  "claude-code",
    "candidate_commit":  "1111111111111111111111111111111111111111",
    "review_commit":  "2222222222222222222222222222222222222222",
    "repair_commit":  null,
    "verdict":  "changes_requested",
    "gate_result":  "denied",
    "repair_round":  1,
    "events":  [
                   {
                       "event_type":  "REPAIR_BRIDGE_READY",
                       "actor":  "codex"
                   }
               ],
    "produced_files":  [
                           ".codex/repair-bridge-observation.json"
                       ],
    "errors":  [

               ],
    "created_at":  "2026-06-27T06:28:05.196Z"
}

